{
  "schema_version": "question.v2",
  "external_id": "kunkurcomputer-q-1277-1403-0095",
  "exam": { "degree": "master", "major": "computer-engineering", "year": 1403, "code": "1277" },
  "slot": { "booklet": 1, "number": 95, "section": "مجموعه دروس تخصصی ۳" },
  "subject_code": "computer-architecture",
  "topic_codes": [],
  "stem_blocks": [{ "type": "text", "text": "کدام گزینه درست است؟ $a+b$" }],
  "options": [
    { "number": 1, "blocks": [{ "type": "text", "text": "یک" }] },
    { "number": 2, "blocks": [{ "type": "text", "text": "دو" }] },
    { "number": 3, "blocks": [{ "type": "text", "text": "سه" }] },
    { "number": 4, "blocks": [{ "type": "text", "text": "چهار" }] }
  ],
  "correct_option": 2,
  "accepted_options": [2, 3],
  "solution_blocks": [],
  "review": { "text_verified": true, "key_verified": false },
  "source": { "page": 23, "question_number": 95, "booklet": 1, "archive_path": "ce/03/1403.pdf" },
  "provenance": { "producer_type": "ocr", "producer_name": "mistral-ocr + owner review", "source_artifact": "ce/03/1403.pdf" }
}
